location	lat	long	fact
Бутырская тюрьма	55.7848282	37.5935974	Здесь В. В. Маяковский провел 11 месяцев в одиночной камере №103 и был освобожден 11 января 1910 года.
Мемориальная квартира Андрея Белого	55.747388	37.585386	Мемориальная квартира Андрея Белого - единственная в мире экспозиция, посвящённая Андрею Белому, гениальному литературному новатору, философу и мистику.
Дом Брюсова	55.778350	37.633167	Валерий Брюсов переехал в дом, принадлежащий купцу Ивану Баеву, в середине августа 1910 года.
Дом Бунина в Хрущевском переулке	55.744308	37.596201
Дом Бунина в Староконюшенном переулке	55.749587	37.595339
Дом Бунина на Поварской улице	55.754937	37.593695
